{
  "schema_version": "atlas.notum-glass-codex-health.v1",
  "monitoring_owners": ["NOTUMS_WATCH", "OPERATION_SENTINEL"],
  "presentation_owner": "OPERATION_GLASS_CODEX",
  "access": "READ_ONLY_MINIMIZED_PROJECTION",
  "states": ["CURRENT", "STALE", "OFFLINE", "UNKNOWN", "LAST_KNOWN_GOOD"],
  "required_observation_fields": ["SOURCE_IDENTITY", "OBSERVED_AT", "RECEIVED_AT", "FRESHNESS_DEADLINE", "STATE", "SANITIZED_SUMMARY"],
  "allowed_projection_data": ["SERVICE_CATEGORY", "COARSE_STATE", "SANITIZED_SUMMARY", "TIMESTAMPS", "FRESHNESS_POLICY", "APPROVED_EVIDENCE_POINTER"],
  "excluded_data": ["CREDENTIALS", "TOKENS", "PRIVATE_NETWORK_MAPS", "UNRESTRICTED_LOGS", "DEVICE_REGISTERS", "RAW_TOPOLOGY", "PROTECTED_HOUSEHOLD_EVIDENCE", "CONTROL_ENDPOINTS", "SECRETS"],
  "denied_actions": ["POWER", "RESTART", "NETWORK_CHANGE", "ROUTE_CHANGE", "DNS_CHANGE", "DHCP_CHANGE", "RESTORE", "FAILOVER", "DEPLOYMENT", "DELETION", "ALERT_ACKNOWLEDGEMENT", "MONITORING_CONFIGURATION", "AUTOMATED_RECOVERY"],
  "failure_independence": ["GLASS_OR_APOLLO_FAILURE_REMOVES_VIEW_ONLY", "MONITORING_COLLECTION_CONTINUES", "MONITORING_ALERTING_CONTINUES", "NOTUM_FAILURE_DOES_NOT_BLOCK_CLOUD_ATLAS", "NOTUM_FAILURE_DOES_NOT_BLOCK_PRIME_RECOVERY", "NOTUM_FAILURE_DOES_NOT_BLOCK_HOUSEHOLD_CRITICAL_WORKLOADS"],
  "freshness_rules": ["EXPIRED_IS_STALE", "MISSING_OR_MALFORMED_IS_UNKNOWN", "LAST_KNOWN_GOOD_IS_CONTEXT_ONLY", "STALE_CANNOT_RENDER_AS_CURRENT", "NO_AUTOMATION_FROM_PRESENTED_STATE"],
  "deployment_state": "ARCHITECTURE_ONLY_NOT_CONNECTED"
}
